id,sport,question,correct_answer,choice_a,choice_b,choice_c,choice_d,difficulty,points,category_tag
1,MLB,Who holds the record for most career home runs,Barry Bonds – 762,Barry Bonds – 762,Derek Jeter,Kobe Bryant,Tim Duncan,Easy,1,Records
2,MLB,Which team has won the most World Series titles,New York Yankees – 27,New York Yankees – 27,Cincinnati Reds,Detroit Tigers,New York Mets,Easy,1,Championships
3,MLB,Who is known as The Sultan of Swat,Babe Ruth,Babe Ruth,Randy Johnson,Mariano Rivera,Tim Duncan,Easy,1,Players
4,MLB,What year was the first World Series played,1903,1903,1893,1908,1883,Medium,2,History
5,MLB,Who holds the record for most career hits,Pete Rose – 4256,Pete Rose – 4256,Alex Rodriguez,Ted Williams,LeBron James,Easy,1,Records
6,MLB,Which pitcher has the most career wins,Cy Young – 511,Cy Young – 511,Willie Mays,Stephen Curry,Ken Griffey Jr,Medium,2,Records
7,MLB,What team did Jackie Robinson debut with,Brooklyn Dodgers,Brooklyn Dodgers,Boston Red Sox,Toronto Blue Jays,St. Louis Cardinals,Easy,1,History
8,MLB,Who broke Babe Ruths single season home run record in 1961,Roger Maris – 61,Roger Maris – 61,Allen Iverson,Kareem Abdul-Jabbar,Alex Rodriguez,Medium,2,Records
9,MLB,Which player has the most stolen bases all time,Rickey Henderson – 1406,Rickey Henderson – 1406,Larry Bird,LeBron James,Shaquille O'Neal,Easy,1,Records
10,MLB,What is the name of the MLB championship trophy,Commissioners Trophy,Commissioners Trophy,Most Valuable Player,Rookie of the Year,Silver Slugger,Easy,1,Awards
11,MLB,Which team ended the Curse of the Bambino,Boston Red Sox – 2004,Boston Red Sox – 2004,New York Mets,Seattle Mariners,Toronto Blue Jays,Easy,1,History
12,MLB,Who was the first player unanimously elected to the Hall of Fame,Mariano Rivera,Mariano Rivera,Stephen Curry,Roger Clemens,Nolan Ryan,Medium,2,History
13,MLB,What is a perfect game,27 batters retired with no hits walks or errors,27 batters retired with no hits walks or errors,Barry Bonds,Stephen Curry,Wilt Chamberlain,Easy,1,Rules
14,MLB,Who has the most career strikeouts,Nolan Ryan – 5714,Nolan Ryan – 5714,LeBron James,Giannis Antetokounmpo,Allen Iverson,Easy,1,Records
15,MLB,Which team plays at Wrigley Field,Chicago Cubs,Chicago Cubs,Kansas City Royals,Colorado Rockies,New York Mets,Easy,1,Teams
16,MLB,Who won the Triple Crown in 2012,Miguel Cabrera,Miguel Cabrera,Larry Bird,Willie Mays,Tim Duncan,Medium,2,Records
17,MLB,Which team is known as the Bronx Bombers,New York Yankees,New York Yankees,Arizona Diamondbacks,Seattle Mariners,Pittsburgh Pirates,Easy,1,Nicknames
18,MLB,What does ERA stand for,Earned Run Average,Earned Run Average,Offensive foul for running into a defender,Walks and Hits per Inning Pitched,Returning ball to backcourt illegally,Easy,1,Stats
19,MLB,Who was the youngest MVP in MLB history,Vida Blue – 22,Vida Blue – 22,Kareem Abdul-Jabbar,Giannis Antetokounmpo,Derek Jeter,Hard,3,Records
20,MLB,Which player hit 70 home runs in 1998,Mark McGwire,Mark McGwire,Charles Barkley,Nolan Ryan,Babe Ruth,Medium,2,Records
21,MLB,Who is the all time saves leader,Mariano Rivera – 652,Mariano Rivera – 652,Stephen Curry,Giannis Antetokounmpo,Charles Barkley,Easy,1,Records
22,MLB,What team drafted Derek Jeter,New York Yankees,New York Yankees,Tampa Bay Rays,Arizona Diamondbacks,Pittsburgh Pirates,Easy,1,Players
23,MLB,Who threw the fastest recorded pitch,Aroldis Chapman – 105.1 mph,Aroldis Chapman – 105.1 mph,Allen Iverson,Larry Bird,Charles Barkley,Medium,2,Records
24,MLB,What is the distance between bases,90 feet,90 feet,Mike Trout,Allen Iverson,Randy Johnson,Easy,1,Rules
25,MLB,Who was the first African American player in MLB,Jackie Robinson,Jackie Robinson,Tim Duncan,Hank Aaron,Kobe Bryant,Easy,1,History
26,MLB,Which team has the longest World Series drought,Chicago Cubs – 108 years,Chicago Cubs – 108 years,San Diego Padres,Arizona Diamondbacks,Chicago White Sox,Medium,2,History
27,MLB,Who hit the Shot Heard Round the World,Bobby Thomson,Bobby Thomson,Mike Trout,Roger Clemens,Magic Johnson,Hard,3,History
28,MLB,What player was known as Mr October,Reggie Jackson,Reggie Jackson,The Big Unit,The Answer,His Airness,Easy,1,Nicknames
29,MLB,Who has the highest career batting average,Ty Cobb – .366,Ty Cobb – .366,Magic Johnson,Mike Trout,Kobe Bryant,Medium,2,Records
30,MLB,What is the term for four strikeouts in one game by a batter,Golden Sombrero,Golden Sombrero,Positioning to secure rebound,Forceful downward score into basket,Illegal pitching motion advancing runners,Easy,1,Quirky
31,MLB,Which team relocated from Montreal to Washington Nationals,Montreal Expos,Montreal Expos,Philadelphia Phillies,Oakland Athletics,Minnesota Twins,Medium,2,History
32,MLB,Who was the first 40 40 player,Jose Canseco,Jose Canseco,LeBron James,Babe Ruth,Kareem Abdul-Jabbar,Medium,2,Records
33,MLB,What pitcher threw a no hitter while on LSD according to legend,Dock Ellis,Dock Ellis,Willie Mays,Michael Jordan,Larry Bird,Easy,1,Quirky
34,MLB,Who caught the final out of the 2004 World Series,Johnny Damon,Johnny Damon,Charles Barkley,Mike Trout,Willie Mays,Hard,3,History
35,MLB,What is the nickname for a walk off home run,Walk off,Walk off,Charles Barkley,Barry Bonds,Nolan Ryan,Easy,1,Rules
36,MLB,Who was the first player to reach 3000 hits and 500 home runs,Hank Aaron,Hank Aaron,Allen Iverson,Willie Mays,Babe Ruth,Medium,2,Records
37,MLB,Which stadium is nicknamed The Green Monster home,Fenway Park,Fenway Park,Yankee Stadium,Madison Square Garden,Chase Center,Easy,1,Stadiums
38,MLB,Who has the most RBIs all time,Hank Aaron – 2297,Hank Aaron – 2297,Michael Jordan,Stephen Curry,LeBron James,Medium,2,Records
39,MLB,Which player played for both the Yankees and Red Sox and was controversial,Babe Ruth,Babe Ruth,Allen Iverson,Magic Johnson,Barry Bonds,Medium,2,History
40,MLB,What is the infield fly rule designed to prevent,Fielders intentionally dropping easy pop ups for double plays,Fielders intentionally dropping easy pop ups for double plays,Illegal pitching motion advancing runners,Returning ball to backcourt illegally,Positioning to secure rebound,Hard,3,Rules
41,MLB,Who won the most Cy Young Awards,Roger Clemens – 7,Roger Clemens – 7,Barry Bonds,Charles Barkley,Allen Iverson,Easy,1,Awards
42,MLB,Which player was known as The Iron Man for consecutive games played,Cal Ripken Jr – 2632,Cal Ripken Jr – 2632,Stephen Curry,Babe Ruth,Michael Jordan,Easy,1,Records
43,MLB,What is the term for hitting for the cycle,Single double triple and home run in one game,Single double triple and home run in one game,Failure to shoot within 24 seconds,Offensive foul for running into a defender,Forceful downward score into basket,Easy,1,Rules
44,MLB,Who was the first unanimous MVP in MLB history,Frank Robinson,Frank Robinson,Shaquille O'Neal,Nolan Ryan,Barry Bonds,Hard,3,History
45,MLB,Which team has a rally monkey as a mascot,Los Angeles Angels,Los Angeles Angels,Washington Nationals,San Francisco Giants,Chicago Cubs,Easy,1,Quirky
46,MLB,What pitcher has the most no hitters,Nolan Ryan – 7,Nolan Ryan – 7,Larry Bird,Kareem Abdul-Jabbar,LeBron James,Easy,1,Records
47,MLB,Who was nicknamed The Big Unit,Randy Johnson,Randy Johnson,LeBron James,Michael Jordan,Larry Bird,Easy,1,Nicknames
48,MLB,What is a balk,Illegal pitching motion advancing runners,Illegal pitching motion advancing runners,Giannis Antetokounmpo,Nolan Ryan,Michael Jordan,Medium,2,Rules
49,MLB,Which player famously charged the mound at Nolan Ryan,Robin Ventura,Robin Ventura,Mike Trout,Randy Johnson,Michael Jordan,Medium,2,Quirky
50,MLB,Who hit the longest recorded home run,Mickey Mantle estimated 565 feet,Mickey Mantle estimated 565 feet,Alex Rodriguez,Ken Griffey Jr,Babe Ruth,Hard,3,Quirky
51,MLB,Who was the first player to hit 60 home runs in a season,Babe Ruth – 60 in 1927,Babe Ruth – 60 in 1927,Wilt Chamberlain,Ted Williams,Barry Bonds,Easy,1,Records
52,MLB,Which team won the 2016 World Series,Chicago Cubs,Chicago Cubs,Oakland Athletics,Kansas City Royals,Colorado Rockies,Easy,1,Championships
53,MLB,Who has the most career doubles,Tris Speaker – 792,Tris Speaker – 792,Kevin Durant,Stephen Curry,Randy Johnson,Hard,3,Records
54,MLB,What is the standard height of the pitchers mound,10 inches,10 inches,Babe Ruth,Michael Jordan,Charles Barkley,Medium,2,Rules
55,MLB,Who was the first designated hitter in MLB,Ron Blomberg,Ron Blomberg,Ken Griffey Jr,Michael Jordan,Barry Bonds,Hard,3,History
56,MLB,Which player has the most career games played,Pete Rose – 3562,Pete Rose – 3562,Michael Jordan,Alex Rodriguez,Randy Johnson,Medium,2,Records
57,MLB,Who won the 2020 World Series,Los Angeles Dodgers,Los Angeles Dodgers,Willie Mays,Mariano Rivera,Kevin Durant,Easy,1,Championships
58,MLB,Which pitcher had a 20 strikeout game in 1986,Roger Clemens,Roger Clemens,Willie Mays,Kareem Abdul-Jabbar,Hank Aaron,Medium,2,Records
59,MLB,Who holds the record for most runs scored,Rickey Henderson – 2295,Rickey Henderson – 2295,Kareem Abdul-Jabbar,Larry Bird,Barry Bonds,Medium,2,Records
60,MLB,What is the foul pole used to determine,Fair or foul on deep hits,Fair or foul on deep hits,Mike Trout,Charles Barkley,Randy Johnson,Easy,1,Rules
61,MLB,Which team was formerly known as the Devil Rays,Tampa Bay Rays,Tampa Bay Rays,St. Louis Cardinals,New York Mets,New York Yankees,Easy,1,Teams
62,MLB,Who won back to back MVP awards in 2012 and 2013,Miguel Cabrera,Miguel Cabrera,Stephen Curry,Randy Johnson,Kevin Durant,Medium,2,Awards
63,MLB,What is the term for a pitcher striking out three batters on nine pitches,Immaculate Inning,Immaculate Inning,Illegal movement without dribbling,Forceful downward score into basket,Walks and Hits per Inning Pitched,Medium,2,Quirky
64,MLB,Who has the most career triples,Sam Crawford – 309,Sam Crawford – 309,Mariano Rivera,Alex Rodriguez,Allen Iverson,Hard,3,Records
65,MLB,Which team plays at Dodger Stadium,Los Angeles Dodgers,Los Angeles Dodgers,Pittsburgh Pirates,Atlanta Braves,Colorado Rockies,Easy,1,Teams
66,MLB,Who broke the color barrier in the American League,Larry Doby,Larry Doby,Babe Ruth,Kareem Abdul-Jabbar,Magic Johnson,Medium,2,History
67,MLB,What does WHIP stand for,Walks and Hits per Inning Pitched,Walks and Hits per Inning Pitched,Positioning to secure rebound,Illegal pitching motion advancing runners,Offensive foul for running into a defender,Medium,2,Stats
68,MLB,Who was known as The Kid in MLB,Ken Griffey Jr,Ken Griffey Jr,Giannis Antetokounmpo,Tim Duncan,Randy Johnson,Easy,1,Nicknames
69,MLB,Which pitcher won 300 games most recently,Randy Johnson – 303,Randy Johnson – 303,Randy Johnson,Ken Griffey Jr,Babe Ruth,Hard,3,Records
70,MLB,Who hit a walk off home run in Game 7 of the 1960 World Series,Bill Mazeroski,Bill Mazeroski,Willie Mays,Barry Bonds,Nolan Ryan,Hard,3,History
71,MLB,Which team has the most losses in a single season,New York Mets – 120 losses in 1962,New York Mets – 120 losses in 1962,Washington Nationals,Houston Astros,Minnesota Twins,Hard,3,Records
72,MLB,What is the term for a relief pitcher entering with runners on base,Inherited Runners,Inherited Runners,Illegal movement without dribbling,Walks and Hits per Inning Pitched,Failure to shoot within 24 seconds,Easy,1,Stats
73,MLB,Who won the 1998 AL MVP,Juan Gonzalez,Juan Gonzalez,Charles Barkley,Stephen Curry,Ted Williams,Hard,3,Awards
74,MLB,Which stadium was nicknamed The House That Ruth Built,Yankee Stadium original,Yankee Stadium original,Wrigley Field,Yankee Stadium,Dodger Stadium,Medium,2,Stadiums
75,MLB,Who has the most career shutouts,Walter Johnson – 110,Walter Johnson – 110,Charles Barkley,Ted Williams,Willie Mays,Hard,3,Records
76,MLB,What is a squeeze play,Bunt to score a runner from third,Bunt to score a runner from third,Roger Clemens,Tim Duncan,Ted Williams,Medium,2,Rules
77,MLB,Who was the first pitcher to throw 100 mph officially,Nolan Ryan,Nolan Ryan,Mike Trout,Tim Duncan,Barry Bonds,Medium,2,Records
78,MLB,Which team won the 1986 World Series,New York Mets,New York Mets,Los Angeles Dodgers,Kansas City Royals,Milwaukee Brewers,Easy,1,Championships
79,MLB,Who holds the record for most errors by a shortstop,Bill Dahlen – 975,Bill Dahlen – 975,Magic Johnson,Babe Ruth,Wilt Chamberlain,Hard,3,Records
80,MLB,What is the Mendoza Line,Batting average around 200,Batting average around 200,Derek Jeter,Willie Mays,Kobe Bryant,Easy,1,Quirky
81,MLB,Who won the 2017 World Series,Houston Astros,Houston Astros,Barry Bonds,LeBron James,Nolan Ryan,Easy,1,Championships
82,MLB,Which player has the most career grand slams,Alex Rodriguez – 25,Alex Rodriguez – 25,Wilt Chamberlain,Mariano Rivera,Charles Barkley,Medium,2,Records
83,MLB,Who was the first player to win Rookie of the Year and MVP in same season,Fred Lynn,Fred Lynn,Nolan Ryan,Wilt Chamberlain,Willie Mays,Hard,3,Records
84,MLB,What is OPS short for,On base plus slugging,On base plus slugging,Magic Johnson,Giannis Antetokounmpo,Allen Iverson,Medium,2,Stats
85,MLB,Which team has a sausage race during games,Milwaukee Brewers,Milwaukee Brewers,Washington Nationals,Los Angeles Angels,Tampa Bay Rays,Easy,1,Quirky
86,MLB,Who hit the first home run in MLB history,William Hoy,William Hoy,Larry Bird,Derek Jeter,Magic Johnson,Hard,3,History
87,MLB,Which player was known as The Splendid Splinter,Ted Williams,Ted Williams,Barry Bonds,Tim Duncan,Ken Griffey Jr,Easy,1,Nicknames
88,MLB,What is a can of corn,Easy fly ball,Easy fly ball,Wilt Chamberlain,Hank Aaron,Roger Clemens,Easy,1,Quirky
89,MLB,Who has the most career intentional walks,Barry Bonds – 688,Barry Bonds – 688,LeBron James,Derek Jeter,Magic Johnson,Hard,3,Records
90,MLB,Which team won the 2009 World Series,New York Yankees,New York Yankees,New York Mets,St. Louis Cardinals,Cincinnati Reds,Easy,1,Championships
91,MLB,Who was the first closer to record 500 saves,Trevor Hoffman,Trevor Hoffman,Charles Barkley,Alex Rodriguez,Ted Williams,Medium,2,Records
92,MLB,What is a double switch,Substitution involving pitcher and position player,Substitution involving pitcher and position player,Stephen Curry,Michael Jordan,Alex Rodriguez,Hard,3,Rules
93,MLB,Which player famously flipped his bat in 2015 playoffs,Jose Bautista,Jose Bautista,Randy Johnson,Nolan Ryan,Ted Williams,Easy,1,Quirky
94,MLB,Who has the most career hit by pitches,Hughie Jennings – 287,Hughie Jennings – 287,Giannis Antetokounmpo,Shaquille O'Neal,LeBron James,Hard,3,Records
95,MLB,Which team moved from Seattle to become the Milwaukee Brewers,Seattle Pilots,Seattle Pilots,Minnesota Twins,New York Yankees,Pittsburgh Pirates,Medium,2,History
96,MLB,What is a ground rule double,Ball automatically awarded two bases,Ball automatically awarded two bases,Returning ball to backcourt illegally,Illegal movement without dribbling,Positioning to secure rebound,Easy,1,Rules
97,MLB,Who won the 2001 World Series,Arizona Diamondbacks,Arizona Diamondbacks,Nolan Ryan,LeBron James,Derek Jeter,Medium,2,Championships
98,MLB,Which player has the highest single season batting average since 1941,Ted Williams – 406,Ted Williams – 406,Randy Johnson,Charles Barkley,LeBron James,Hard,3,Records
99,MLB,What is the term for a pitcher who throws sidearm,Submarine pitcher,Submarine pitcher,Walks and Hits per Inning Pitched,Positioning to secure rebound,Offensive foul for running into a defender,Medium,2,Quirky
100,MLB,Who caught the final out of the 2016 World Series,Michael Martinez,Michael Martinez,Mike Trout,Allen Iverson,Randy Johnson,Hard,3,History
101,NBA,Who is the all time leading scorer in NBA history,LeBron James – over 39000,LeBron James – over 39000,Mike Trout,Giannis Antetokounmpo,Magic Johnson,Easy,1,Records
102,NBA,Which team has won the most NBA championships,Boston Celtics – 17 tied,Boston Celtics – 17 tied,Minnesota Timberwolves,Cleveland Cavaliers,Detroit Pistons,Easy,1,Championships
103,NBA,Who is known as His Airness,Michael Jordan,Michael Jordan,Kareem Abdul-Jabbar,Charles Barkley,Stephen Curry,Easy,1,Nicknames
104,NBA,What year was the NBA founded,1946,1946,1936,1951,1926,Medium,2,History
105,NBA,Who has the most career assists,John Stockton – 15806,John Stockton – 15806,Allen Iverson,Kevin Durant,Mariano Rivera,Easy,1,Records
106,NBA,Which team drafted Kobe Bryant,Charlotte Hornets traded to Los Angeles Lakers,Charlotte Hornets traded to Los Angeles Lakers,Milwaukee Bucks,Miami Heat,Phoenix Suns,Medium,2,History
107,NBA,Who has the most career rebounds,Wil Chamberlain – 23924,Wil Chamberlain – 23924,Nolan Ryan,LeBron James,Larry Bird,Medium,2,Records
108,NBA,What is a triple double,Double digits in three statistical categories,Double digits in three statistical categories,Alex Rodriguez,Wilt Chamberlain,Michael Jordan,Easy,1,Rules
109,NBA,Who won the 2016 NBA Finals,Cleveland Cavaliers,Cleveland Cavaliers,Roger Clemens,Hank Aaron,Barry Bonds,Easy,1,Championships
110,NBA,Which player scored 100 points in a single game,Wil Chamberlain – 100,Wil Chamberlain – 100,Charles Barkley,Mike Trout,Giannis Antetokounmpo,Easy,1,Records
111,NBA,Who has the most MVP awards,Kareem Abdul Jabbar – 6,Kareem Abdul Jabbar – 6,LeBron James,Allen Iverson,Kevin Durant,Easy,1,Awards
112,NBA,What team is known as the Showtime Lakers,Los Angeles Lakers,Los Angeles Lakers,Sacramento Kings,Houston Rockets,Dallas Mavericks,Easy,1,Nicknames
113,NBA,Who was the first overall pick in the 2003 NBA Draft,LeBron James,LeBron James,Shaquille O'Neal,Allen Iverson,Alex Rodriguez,Easy,1,History
114,NBA,Which player is known as The Greek Freak,Giannis Antetokounmpo,Giannis Antetokounmpo,Mike Trout,Charles Barkley,Alex Rodriguez,Easy,1,Nicknames
115,NBA,Who has the most career steals,John Stockton – 3265,John Stockton – 3265,Kevin Durant,Alex Rodriguez,Barry Bonds,Medium,2,Records
116,NBA,What is the length of an NBA game,48 minutes,48 minutes,Roger Clemens,LeBron James,Tim Duncan,Easy,1,Rules
117,NBA,Who won the 2020 NBA Finals,Los Angeles Lakers,Los Angeles Lakers,Ken Griffey Jr,Wilt Chamberlain,Charles Barkley,Easy,1,Championships
118,NBA,Which player is known as The Answer,Allen Iverson,Allen Iverson,Roger Clemens,Magic Johnson,Kareem Abdul-Jabbar,Easy,1,Nicknames
119,NBA,Who holds the record for most three pointers made,Stephen Curry,Stephen Curry,Barry Bonds,Hank Aaron,Ken Griffey Jr,Easy,1,Records
120,NBA,What is a slam dunk,Forceful downward score into basket,Forceful downward score into basket,Willie Mays,Randy Johnson,Roger Clemens,Easy,1,Rules
121,NBA,Who was the Finals MVP in 1998,Michael Jordan,Michael Jordan,Alex Rodriguez,Ken Griffey Jr,LeBron James,Medium,2,Championships
122,NBA,Which team relocated from Seattle to become the Oklahoma City Thunder,Seattle SuperSonics,Seattle SuperSonics,Miami Heat,Milwaukee Bucks,Boston Celtics,Medium,2,History
123,NBA,Who has the highest career points per game average,Michael Jordan – 30.1,Michael Jordan – 30.1,Allen Iverson,Babe Ruth,Alex Rodriguez,Medium,2,Records
124,NBA,What is a technical foul,Violation of sportsmanship rules,Violation of sportsmanship rules,Barry Bonds,Ted Williams,Michael Jordan,Medium,2,Rules
125,NBA,Who won Rookie of the Year in 2019,Luka Doncic,Luka Doncic,Randy Johnson,Charles Barkley,Magic Johnson,Medium,2,Awards
126,NBA,Which player was known as Big Fundamental,Tim Duncan,Tim Duncan,Giannis Antetokounmpo,Derek Jeter,LeBron James,Easy,1,Nicknames
127,NBA,Who has the most career blocks,Hakeem Olajuwon – 3830,Hakeem Olajuwon – 3830,LeBron James,Ted Williams,Larry Bird,Hard,3,Records
128,NBA,What is the three point line distance,23.75 feet average,23.75 feet average,Derek Jeter,Hank Aaron,Kobe Bryant,Medium,2,Rules
129,NBA,Who won the 2019 NBA Finals,Toronto Raptors,Toronto Raptors,Kevin Durant,Stephen Curry,Nolan Ryan,Easy,1,Championships
130,NBA,Which player is known as KD,Kevin Durant,Kevin Durant,Wilt Chamberlain,Kobe Bryant,Roger Clemens,Easy,1,Nicknames
131,NBA,Who has the most triple doubles,Russell Westbrook,Russell Westbrook,Stephen Curry,Tim Duncan,Nolan Ryan,Medium,2,Records
132,NBA,What is a shot clock violation,Failure to shoot within 24 seconds,Failure to shoot within 24 seconds,Alex Rodriguez,Magic Johnson,Michael Jordan,Easy,1,Rules
133,NBA,Who was the first player to win MVP unanimously,Stephen Curry – 2016,Stephen Curry – 2016,Roger Clemens,Kareem Abdul-Jabbar,LeBron James,Medium,2,Records
134,NBA,Which team has a dinosaur mascot,Toronto Raptors,Toronto Raptors,Philadelphia 76ers,Washington Wizards,Memphis Grizzlies,Easy,1,Quirky
135,NBA,Who has the most career turnovers,LeBron James,LeBron James,Ted Williams,Mike Trout,Randy Johnson,Hard,3,Records
136,NBA,What is goaltending,Illegal interference with ball on way down,Illegal interference with ball on way down,Kevin Durant,Charles Barkley,Kareem Abdul-Jabbar,Medium,2,Rules
137,NBA,Who won the 2008 NBA Finals,Boston Celtics,Boston Celtics,Willie Mays,Ted Williams,Larry Bird,Easy,1,Championships
138,NBA,Which player is known as The Beard,James Harden,James Harden,Allen Iverson,Derek Jeter,Mariano Rivera,Easy,1,Nicknames
139,NBA,Who has the most career games played,Robert Parish – 1611,Robert Parish – 1611,Allen Iverson,Charles Barkley,Roger Clemens,Hard,3,Records
140,NBA,What is a fast break,Quick transition scoring opportunity,Quick transition scoring opportunity,Alex Rodriguez,Roger Clemens,Kevin Durant,Easy,1,Rules
141,NBA,Who won MVP in 2000,Shaquille O Neal,Shaquille O Neal,Ted Williams,Randy Johnson,Michael Jordan,Medium,2,Awards
142,NBA,Which team drafted Dirk Nowitzki,Milwaukee Bucks traded to Dallas Mavericks,Milwaukee Bucks traded to Dallas Mavericks,LA Clippers,Minnesota Timberwolves,Washington Wizards,Hard,3,History
143,NBA,Who has the most career free throws made,Karl Malone – 9787,Karl Malone – 9787,Shaquille O'Neal,Derek Jeter,Kevin Durant,Medium,2,Records
144,NBA,What is a double dribble,Illegal second dribble after stopping,Illegal second dribble after stopping,Kareem Abdul-Jabbar,Wilt Chamberlain,Magic Johnson,Easy,1,Rules
145,NBA,Who was Finals MVP in 2013,LeBron James,LeBron James,Magic Johnson,Michael Jordan,Kareem Abdul-Jabbar,Medium,2,Championships
146,NBA,Which player is known as The Mailman,Karl Malone,Karl Malone,Michael Jordan,Wilt Chamberlain,Babe Ruth,Easy,1,Nicknames
147,NBA,Who has the most points in a playoff game,Michael Jordan – 63,Michael Jordan – 63,Shaquille O'Neal,Larry Bird,Ken Griffey Jr,Hard,3,Records
148,NBA,What is a backcourt violation,Returning ball to backcourt illegally,Returning ball to backcourt illegally,Mike Trout,Tim Duncan,Larry Bird,Medium,2,Rules
149,NBA,Who won the 1995 NBA Finals,Houston Rockets,Houston Rockets,Mike Trout,Giannis Antetokounmpo,Hank Aaron,Easy,1,Championships
150,NBA,Which player famously broke a backboard with a dunk,Darryl Dawkins,Darryl Dawkins,Kareem Abdul-Jabbar,Willie Mays,Barry Bonds,Medium,2,Quirky
151,NBA,Who holds the record for most points scored in a rookie season,Wil Chamberlain – 2707,Wil Chamberlain – 2707,Hank Aaron,Mariano Rivera,Roger Clemens,Hard,3,Records
152,NBA,Which team won the 2021 NBA Finals,Milwaukee Bucks,Milwaukee Bucks,LA Clippers,Detroit Pistons,Brooklyn Nets,Easy,1,Championships
153,NBA,Who has the most career field goals made,Kareem Abdul Jabbar – 15837,Kareem Abdul Jabbar – 15837,Charles Barkley,Babe Ruth,Mariano Rivera,Medium,2,Records
154,NBA,What is the width of an NBA court,50 feet,50 feet,Kobe Bryant,Randy Johnson,Michael Jordan,Medium,2,Rules
155,NBA,Who was the first player to enter the NBA straight from high school,Moses Malone,Moses Malone,Tim Duncan,Kevin Durant,Nolan Ryan,Hard,3,History
156,NBA,Which player is known as The Admiral,David Robinson,David Robinson,Ted Williams,Magic Johnson,Kareem Abdul-Jabbar,Easy,1,Nicknames
157,NBA,Who has the most career minutes played,Kareem Abdul Jabbar – over 57000,Kareem Abdul Jabbar – over 57000,Alex Rodriguez,Stephen Curry,Mariano Rivera,Hard,3,Records
158,NBA,What is a flagrant foul,Excessive or violent contact,Excessive or violent contact,Larry Bird,Derek Jeter,Michael Jordan,Medium,2,Rules
159,NBA,Who won the 2011 NBA Finals,Dallas Mavericks,Dallas Mavericks,Michael Jordan,Kareem Abdul-Jabbar,Kobe Bryant,Easy,1,Championships
160,NBA,Which player is known as The Dream,Hakeem Olajuwon,Hakeem Olajuwon,Ken Griffey Jr,Allen Iverson,Kobe Bryant,Easy,1,Nicknames
161,NBA,Who has the most career offensive rebounds,Moses Malone – 7382,Moses Malone – 7382,Ken Griffey Jr,Wilt Chamberlain,Stephen Curry,Hard,3,Records
162,NBA,What is the diameter of a basketball hoop,18 inches,18 inches,Kareem Abdul-Jabbar,Kobe Bryant,Alex Rodriguez,Easy,1,Rules
163,NBA,Who was the first overall pick in the 1997 NBA Draft,Tim Duncan,Tim Duncan,Allen Iverson,Roger Clemens,Wilt Chamberlain,Medium,2,History
164,NBA,Which team drafted Kevin Garnett,Minnesota Timberwolves,Minnesota Timberwolves,LA Clippers,Dallas Mavericks,Brooklyn Nets,Medium,2,Players
165,NBA,Who has the most career playoff points,LeBron James – over 8000,LeBron James – over 8000,Mariano Rivera,Hank Aaron,Nolan Ryan,Medium,2,Records
166,NBA,What is a charge foul,Offensive foul for running into a defender,Offensive foul for running into a defender,Larry Bird,Willie Mays,Allen Iverson,Easy,1,Rules
167,NBA,Who won the 2014 NBA Finals,San Antonio Spurs,San Antonio Spurs,Magic Johnson,Kevin Durant,Ken Griffey Jr,Easy,1,Championships
168,NBA,Which player is known as The Truth,Paul Pierce,Paul Pierce,LeBron James,Charles Barkley,Shaquille O'Neal,Easy,1,Nicknames
169,NBA,Who has the most career defensive rebounds,Tim Duncan,Tim Duncan,Barry Bonds,Randy Johnson,Mariano Rivera,Hard,3,Records
170,NBA,What is a travel violation,Illegal movement without dribbling,Illegal movement without dribbling,Kareem Abdul-Jabbar,Kevin Durant,Tim Duncan,Easy,1,Rules
171,NBA,Who won MVP in 1992,Michael Jordan,Michael Jordan,Kobe Bryant,Mike Trout,Alex Rodriguez,Medium,2,Awards
